<?xml version="1.0" encoding="UTF-8" ?>
<xs:schema xmlns:xs="http://www.w3.org/2001/XMLSchema">
    <xs:element name="phoneContacts">
        <xs:complexType>
            <xs:sequence>
                <xs:element name="contact" type="person" maxOccurs="unbounded" />
            </xs:sequence>
        </xs:complexType>
    </xs:element>
    <xs:complexType name="person">
        <xs:all>
            <xs:element name="firstname" minOccurs="0">
                <xs:simpleType>
                    <xs:restriction base="xs:string">
                        <xs:minLength value="2"/>
                    </xs:restriction>
                </xs:simpleType>
            </xs:element>
            <xs:element name="lastname" type="xs:string" />
            <xs:element name="birthDate" type="xs:date" />
            <xs:element name="phoneNumber">
                <xs:complexType>
                    <xs:simpleContent>
                        <xs:extension base="xs:string">
                            <xs:attribute name="isMobileNumber" type="xs:boolean" default="false"/>
                        </xs:extension>
                    </xs:simpleContent>
                </xs:complexType>
            </xs:element>
        </xs:all>
    </xs:complexType>
</xs:schema>